"filename","mahkeme","dosya_no","karar_no","tarih","dava_konusu","icerik"
"2017_1002_2018_940_479338800.html","8. HUKUK DAİRESİ","2017/1002","2018/940","06/03/2017","Ölüm Ve Cismani Zarar Sebebiyle Açılan Tazminat","GEREĞİ DÜŞÜNÜLDÜ: Davacılar vekili dilekçesi ile; müvekkillerinin murisi ...'ın 15/06/2014 tarihinde davalı ...'ın sevk ve idaresindeki araç ile seyir halindeyken meydana gelen kaza neticesinde vefat ettiğini, tutulan tutanakta davalı ...ın kazanın meydana gelmesine neden olduğunun tespit edildiğini, diğer davalı sigorta şirketinin müvekkiline 70.556,56-TL tazminat ödediğini, ancak yapılan ödemenin zararın tam karşılığı olmadığını, müvekkillerinin babalarını kaybetmekten dolayı acı çektiklerini bu acıyı bir nebze azaltmak için manevi tazminata da hükmedilmesi gerekitğini belirterek, fazlaya ilişkinhakları saklı kalmak kaydıyla şimdilik davacı ... için 5.000,00-TL destekten yoksun kalma tazminatı ile tüm davacılar için ayrı ayrı 20.000,00-TL manevi tazminatın (sigorta şirketinin sadece maddi tazminattan sorumlu olmak üzere) davalılardan tahsiline karar verilmesini talep etmiş, 21/04/2016 tarihli oslah dilekçesi ile maddi tazminata ilişkin talebini 28.359,56-TL'ye yükseltmiştir. Davalı ... vekili cevap dilekçesi ile; 15/06/2014 tarihinde yaşanan kazanın yolda bulunan çukura su birikmesinden dolayı olduğunu, yoldaki kusur nedeni ile müvekkilinin sevk ve idaresindeki aracın kontrolden çıktığını, kaza neticesinde müvekkilinin ağır yaralandığını, ve 2 akrabasını kaybettiğini, kaza sonrasında tutulan tutanağı kabul etmediklerini belirterek davanın reddine karar verilmesini talep etmiştir.Davalı ...Sigorta A. Ş. vekili cevap dilekçesi ile; davacının maddi tazminat talebinin kabul edilemez olduğunu, kazadan sonra hasar dosyası açıldığını, davacı tarafa ödeme yapıldığını, müvekkilinin başkaca bir sorumluluğunun bulunmadığını belirterek davanın reddine karar verilmesini talep etmiştir.Mahkemece, meydana gelen kazada davalı ...'ın tam kusurlu olduğu, davalı sigorta şirketi tarafından ödeme yapıldığı, davacı tarafın maddi tazminat talebinden feragat ettiği, olayda hatır taşıması da olduğu gözetilerek davacı taraf lehine manevi tazminata hükmedilmesi gerektiği gerekçesiyle; ""1-Davanın kısmen KABUL KISMEN REDDİNE 2-Maddi tazminat talebi yönünden davacıların feragati nedeniyle davanın REDDİNE, 3-Davacıların manevi tazminat taleplerinin kısmen kabulü ile davacı... için 10.000,00 TL, diğer davacılar ... için 4000’er TL olmak üzere toplam 26.000,00 TL manevi tazminatın olay tarihi olan 15/06/2014 tarihinden itibaren işleyecek yasal faiziyle sigorta şirketi dışındaki davalı ...'tan alınarak davacılara verilmesine, fazlaya ilişkin manevi tazminat taleplerinin reddine,"" karar verilmiş, karara karşı davacılar vekili tarafından süresi içinde istinaf yoluna başvurulmuştur.Davacılar vekilinin istinaf sebepleri; hükmedilen manevi tazminat miktarının düşük olduğu, olayda hatır taşımasının bulunmadığı, hakkaniyet indirimi oranının çok yüksek belirlendiği hususlarına ilişkindir.Dava, trafik kazası nedeniyle maddi ve manevi tazminat talebine ilişkin bulunmaktadır.6098 sayılı Türk Borçlar Kanunu’nun 56/1. maddesine göre, hakimin olayın özelliklerini göz önünde tutarak manevi tazminat adı ile hak sahibi yararına takdir edeceği para tutarı adalete uygun olmalıdır. Hükmedilecek bu para, zarara uğrayanda manevi huzuru doğurmayı gerçekleştirecek tazminata benzer işlevi olan özgün bir nitelik taşır. Bir ceza olmadığı gibi, malvarlığı hukukuna ilişkin zararın karşılanması da amaç edinilmemiştir. O halde, tazminatın sınırı onun amacına göre belirlenmelidir.Takdir edilecek miktar, mevcut halde elde edilmek istenilen tatmin duygusunun etkisine ulaşmak için gerektiği kadar olmalıdır. 22/06/1966 günlü ve 7/7 sayılı Yargıtay İçtihadı Birleştirme Kararı'nın gerekçesinde, takdir olunacak manevi tazminatın tutarını etkileyecek özel hal ve şartlar açıkça gösterilmiştir. Bunlar, her olaya göre değişebileceğinden; hakim, bu konuda takdir hakkını kullanırken ona etkili olan nedenleri de karar yerinde objektif ölçülere göre isabetli bir biçimde göstermelidir.Dava konusu olayda, kazanın meydana geldiği tarih, kusur durumu, davacıların müteveffaya olan yakınlıkları, tarafların, dosyaya yansıyan ekonomik ve sosyal durumları, ile yukarıda açıklanan ilkeler göz önünde tutulduğunda; takdir edilen manevi tazminat miktarı azdır. Somut olayın özellikleri göz önünde bulundurularak davacı eş ... için 15.000,00-TL, her bir davacı çocuk için ayrı ayrı 7.500,00'er TL manevi tazminata hükmedilmesi uygun bulunmaktadır. Bu nedenle davacı tarafın istinaf talebinin kabulü ile, vekâlet ücretine ilişkin usuli kazanılmış haklar da gözetilerek, 6100 Sayılı HMK 353/1-b/2 maddesi gereğince davacı lehine daha yüksek bir tazminata hükmedilmesi, Mahkemece verilen kararın düzeltilerek yeniden hüküm kurulması gerektiği kanaatine varılmıştır. HÜKÜM: Gerekçe uyarınca; 1- Bakırköy 4. Asliye Ticaret Mahkemesi'nin 06/03/2017 tarih ve 2014/1083 E.- 2017/246 K. sayılı kararına karşı davacılar vekilince yapılan istinaf talebinin KABULÜNE, 1/1- Davacılar tarafından peşin olarak yatırılan 31,40-TL maktu istinaf karar ve ilam harcı ile 85,70-TL istinaf yoluna başvurma harcının istek halinde kendilerine İADESİNE, 1/2- İstinaf aşamasında davacı tarafından yapılan giderlerin takdiren kendi üzerinde bırakılmasına, 1/3- İncelemenin duruşmasız olarak yapılması nedeniyle avukatlık ücreti takdirine YER OLMADIĞINA, 2- Bakırköy 4. Asliye Ticaret Mahkemesi'nin 06/03/2017 tarih ve 2014/1083 E.- 2017/246 K. sayılı kararının KALDIRILMASINA, 2/1- Davanın kısmen KABUL KISMEN REDDİNE, 2/2- Maddi tazminat talebi yönünden davacıların feragati nedeniyle davanın REDDİNE, 2/3- Davacıların manevi tazminat taleplerinin KISMEN KABUL KISMEN REDDİ ile; davacı ... için takdir edilen 15.000,00-TL, diğer davacılar ... için ayrı ayrı takdir edilen 7.500,00'er TL manevi tazminatın olay tarihi olan 15/06/2014 tarihinden itibaren işleyecek yasal faiziyle birlikte davalı ...'tan alınarak davacılara verilmesine, fazlaya ilişkin manevi tazminat taleplerinin reddine, 2/4- Alınması gereken 3.073,95-TL karar ve ilam harcından davacı tarafça yatırılan 757,57-TL harcın mahsubu ile bakiye 2.316,95-TL nispi karar ve ilam harcının davalı ...'tan alınarak hazineye gelir kaydına, 2/5- Maddi tazminat talebi yönünden davalı sigorta şirketi için vekalet ücreti hükmedilmesine yer olmadığına, 2/6- Maddi tazminat talebi yönünden Mahkeme karar tarihi AAÜT gereğince belirlenen 1.980,00-TL vekalet ücretinin davacılardan tahsili ile davalı ...'a verilmesine, 2/7- Davacılar manevi tazminat davasında kendini vekille temsil ettirdiğinden karar tarihi AAÜT gereğince belirlenen 5.300,00-TL vekâlet ücretinin davalı ...'tan alınarak davacılara verilmesine, 2/8- Davalı ... manevi tazminat davasında kendini vekille temsil ettirdiğinden karar tarihi AAÜT 10/2. maddesi gereğince belirlenen 5.300,00-TL vekâlet ücretinin davacılardan alınarak davalı ...'a verilmesine, 2/9- Davacılar tarafından yapılan ve bilirkişi ücreti, harç, posta ve tebligat gideri olmak üzere toplam 2.035,62-TL yargılama giderinden davanın kabul red oranına göre belirlenen 916,02-TL yargılama giderinin davalı ...'tan alınarak davacı tarafa verilmesine, kalan kısmın davacı taraf üzerinde bırakılmasına, 2/10- Karar kesinleştiğinde ve talep halinde artan gider avansının yatıran tarafa iadesine, Dosya üzerinde yapılan inceleme sonucunda 24/11/2016 tarihli ve 6763 sayılı Kanunun 42 nci maddesi ile değişik HMK.m.362/1-a hükmü gereğince kesin olmak üzere, oy birliğiyle karar verildi.01/10/2018."
"2017_1004_2018_1226_436762900.html","15.HUKUK DAİRESİ","2017/1004","2018/1226","21/02/2017","İtirazın İptali","GEREĞİ GÖRÜŞÜLÜP DÜŞÜNÜLDÜ : Davacı vekili, taraflar arasındaki şifahi anlaşma sonucu Kocaeli'nde bulunan ... AVM'nin yemek katındaki beş adet mağaza ve bir adet deponun inşaat işinin tamamlanıp Haziran 2015'de davalıya teslim edildiğini, taraflar arasındaki pazarlıklar sonucu 286.099,41 TL'de mutabık kalınarak bu miktar için 11/12/2015'de 6 adet fatura düzenlenerek davalıya tebliğ edildiğini, borç ödenmeyince İstanbul ....İcra Müdürlüğünün ...esas sayılı dosyası ile icra takibi yaptıklarını, itiraz üzerine takibin durduğunu, takibin durmasından sonra davalının 286.099,41 TL'yi icra dosyasına yatırmasına rağmen paranın davacıya ödenmesine kötüniyetle muvafakat etmediği için tahsil edilemediğini, davalının itirazında alacak miktarına itiraz etmediğini, TTK'nın 1530/4.maddesinde düzenlenen 30 günlük ödeme süresinin taraflar arasında geçerli olmadığını belirterek, itirazın iptaline, takibin devamına ve %20'den az olmamak üzere icra inkar tazminatının davalıdan tahsiline karar verilmesini talep ve dava etmiştir. Davalı vekili, taraflar arasındaki ticari ilişkinin sözleşmeye dayanmayıp hakedişler üzerinden devam ettiğini, taraflar arasında bir vade kararlaştırılmadığını, davacının hakedişleri geç düzenlediğini, inşaat işinin tamamlandığını, hakedişlerin oluşturulduğunu ve 286.101,42 TL + KDV bedel üzerinde mutabakat sağlandığını, davacının da bu miktarı oluşturan 11/12/2015 tarihli 6 adet fatura düzenlediğini, ancak faturaların vade tarihlerine riayet etmeyerek 22/12/2015 tarihinde haksız ve kötüniyetle icra takibine giriştiğini, müvekkilinin ana parayı ödemek suretiyle 31/12/2015 tarihinde itiraz ettiğini, davacının asıl alacak yanında yüklü miktarda icra harç ve masrafı ile avukatlık ücreti ödenmesini hedeflediğini, müvekkilinin temerrüde düşmediğini, TTK'nın 1530/4. Maddesinde taraflar arasında bir vade öngörülmemiş ise faturanın borçlu tarafından alınmasını takip eden 30 günlük sürenin sonunda temerrüt oluşacağının düzenlendiğini, müvekkiline hiç bir ihtar veya bildirim yapılmadığını, tebliğ aldığı ödeme emri kapsamında dosyaya ödeme yaptığını belirterek, davanın reddine karar verilmesini istemiştir. Mahkemece, taraflar arasında asıl alacak miktarı olan 286.099,41 TL fatura bedeli konusunda uyuşmazlık bulunmadığı, davalının asıl alacağı 12/01/2016 tarihinde ihtirazi kayıt koyarak takip dosyasına ödediği, dava tarihi itibariyle asıl alacak miktarının icra dosyasına depo edilmesi ve faturalara ilişkin 30 günlük vade tarihinin dolmuş olması nazara alındığında davalı yanın vadeye ilişkin itirazının ve ihtirazi kaydının konusuz kaldığı, itirazın ortadan kalktığı, takibe konu faturaların 30 günlük süreden önce takibe konulduğu ve dava tarihinden önce borcun depo edildiği gerekçeleriyle, konusuz kalan davanın esası hakkında karar verilmesine yer olmadığına, davacı tarafın icra inkar tazminatı talebinin reddine karar verilmiştir. Davacı vekili tarafından sunulan istinaf dilekçesinde, davacı lehine icra ve inkar tazminatına hükmedilmemesinin hatalı olduğu, davalı itirazının yalnızca vadeye ilişkin olduğu, dosyaya ödeme yaparken paranın davacıya ödenmesine muvafakat etmeyerek açıkça kötüniyetli olduğunu belirterek, yerel mahkeme kararının kaldırılmasına karar verilmesini istemiştir. Davalı vekili istinaf dilekçesinde, müvekkili lehine hüküm kurmasına rağmen, müvekkilinin davacıya 23.115,96 TL nispi vekalet ücreti ödemesine hükmetmesinin hatalı olduğunu belirterek, yerel mahkemece müvekkili aleyhine vekalet ücretine ilişkin kurduğu hükmün kaldırılmasına karar verilmesini istemiştir. Dava, eser sözleşmesinden kaynaklanan itirazın iptali, takibin devamı ve icra inkar tazminatı istemlerine ilişkindir. Taraflar arasında yazılı sözleşme bulunmayıp, beş mağazanın inşaat işlerinin yapımı konusunda şifahen anlaşıldığı konusunda uyuşmazlık yoktur. Davacı yüklenici tarafından toplam 286.099,41 TL iş bedelinin tahsili için icra takibi yapılmış, davalı süresi içerisinde itiraz dilekçesinde, faturalara konu alacağın vade tarihi dikkate alınmadan ve alacak muaccel hale gelmeden icra takibi yapıldığı gerekçesiyle borca itiraz etmiş, daha sonra sunduğu 12/01/2016 tarihli dilekçesinde, 286.101,41 TL'nin 30 günlük ödeme vadesinin gelmesi nedeniyle itirazi kayıt koyarak icra dairesine havale edildiğini, bunun itirazın geri çekildiği anlamına gelmediğini, ödenen paranın takip alacaklısı tarafında çekilmesine muvafakatının bulunmadığını bildirmiştir. Taraflar arasında iş bedelini oluşturan asıl alacak miktarı konusunda uyuşmazlık bulunmadığı ve itirazın konusuz kaldığı gerekçesiyle esas hakkında karar verilmesine yer olmadığına dair yerel mahkeme kararı yerinde olup, icra inkar tazminatının şartlarının bulunmadığı, vekalet ücretinin de usul ve yasaya uygun olduğu göz önüne alınarak taraf vekillerinin istinaf taleplerinin esastan reddine karar verilmesi gerekmiştir. Açıklanan nedenlerle, tarafların esasa ilişkin istinaf talebi bulunmadığından, istinaf sebepleriyle sınırlı olarak yapılan inceleme ve değerlendirme sonucunda; yerel mahkeme kararı usul ve yasaya uygun bulunduğundan, taraf vekillerinin istinaf taleplerinin esastan reddine karar verilmesi gerekmiştir. HÜKÜM: Gerekçesi yukarıda açıklandığı üzere; 1- İstanbul 16. Asliye Ticaret Mahkemesi'nin 21/02/2017 tarih ve 2016/480 esas, 2017/106 karar sayılı kararında usul ve esas yönünden yasaya aykırı bir durum bulunmamasına göre, taraf vekillerinin istinaf başvurularının HMK'nın 353/1-b-1 maddesi gereğince esastan REDDİNE, 2-Alınması gereken 35,90-TL istinaf karar harcından peşin alınan 31,40-TL'nin mahsubu ile bakiye 4,50-TL istinaf karar harcının davacıdan alınarak HAZİNEYE GELİR KAYDINA, 3-Davalı tarafça yatırılan 895,40 TL istinaf karar harcından alınması gereken 35,90 TL harcın mahsubu ile fazladan yatırılan 859,50 TL harcın kararın kesinleşmesi ve istek halinde davalıya İADESİNE, 4-Taraflarca yapılan istinaf yargılama giderlerinin kendi üzerlerinde bırakılmasına, 5-İstinaf incelemesi sırasında duruşma açılmadığından taraflar yararına vekâlet ücreti takdirine yer olmadığına, Dosya üzerinde yapılan inceleme sonucunda, 6100 sayılı HMK'nın 361. Maddesi gereğince kararın tebliğ tarihinden itibaren 2 hafta içerisinde Yargıtay'da temyiz yolu açık olmak üzere 03/10/2018 tarihinde oybirliği ile karar verildi."
"2017_1006_2018_941_435171000.html","8. HUKUK DAİRESİ","2017/1006","2018/941","29/11/2016","Ölüm Ve Cismani Zarar Sebebiyle Açılan Tazminat","GEREĞİ DÜŞÜNÜLDÜ: Davacı vekili dava dilekçesi ile; 22/08/2009 tarihinde davalılardan... Sigorta A. Ş. tarafından sigortalı bulunan ... plakalı minibüs ile olay yerini terk ettiği için plakası ve niteliği belli olmayan fakat kazaya karıştığı gerek kaza tespit tutanağı gerekse savcılık tahkikat evrakları ile tespit edilen başka bir aracın karışmış olduğu çift taraflı olarak meydana gelen trafik kazası sonucunda ... plakalı minibüs sürücüsü ...'ın vefat ettiğini, müvekkilinin eşinin vefatından dolayı desteğinden yoksun kaldığını, kaza tespit tutanağında herhangi bir kusur tespiti yapılmadığını, ancak gerek müteveffa gerekse olay yerini terk eden sürücünün kusurlu olduğunu, müvekkilinin destekten yoksun kalan 3. kişi sıfatıyla zarara uğradığını belirterek, fazlaya ilişkin hakları saklı kalmak kaydıyla şimdilik 2.100,00-TL destekten yoksun kalma tazminatının davalılardan müştereken ve müteselsilen tahsiline karar verilmesini talep etmiş, 13/04/2016 tarihli ıslah dilekçesiyle, 2.100,00-TL olan maddi tazminat talebini 150.000,00-TL'ye yükseltmiş, ...na karşı açılan davayı atiye terk ettiklerini belirtmiştir. Davalı ... vekili cevap dilekçesi ile; dava konusu kazanın 22/08/2009 tarihinde meydana geldiğini, bu nedenle davanın 2 yıllık zamanaşımına uğradığını, kazanan meydana gelişinde tespit edilemeyen aracın kusur oranının tespit edilmesi halinde tazminatın ödenebileceğini, ancak aracın somut delillerde tespit edilemediğini, bu nedenle müvekkilinin oluşan zarardan sorumlu olamayacağını, müvekkilinin ticari bir şirket olmadığını, bu nedenle talep edilen faiz türününde kabul edilemeyeceğini belirterek davanın reddini talep etmiştir. Davalı ...Sigorta A. Ş. vekili cevap dilekçesi ile; dava konusu kazaya karışan ... plakalı aracın müvekkili şirket tarafından ... numaralı poliçe kapsamında zorunlu mali sorumluluk poliçesi ile teminat altına alındığını, davacı tarafından müvekkili şirkete bir başvuru olmadığını, müteveffanın davaya konu aracın sürücüsü olduğundan mirasçılarının taleplerinin genel şartlar gereği teminat dışı olduğunu belirterek davanın reddini talep etmiştir. Mahkemece; davacının ölen sürücünün eşi olduğu, Karayolları Trafik Kanunu ve kaza tarihinde geçerli ZMMS trafik sigortası poliçe genel şartlarına göre, aracın zorunlu mali sorumluluk sigortacısı olan davalı şirketin, işletenin 3.kişilere verdiği zararları teminat altına aldığı ve somut olayda sürücü ve işletenin tam kusurulu olup destekten yoksun kalan davacıların da zarar gören 3.kişi konumunda bulundukları, ölenin salt mirasçısı sıfatıyla değil destekten yoksun kalan 3.kişi sıfatıyla bu davayı açtıkları anlaşılmakla davalı ... şirketinin zararın tamamından poliçede verilen teminatla sınırlı olmak üzere sorumlu olduğu, 22/08/2009 tarihinde meydana gelen kazada davacının desteği sürücünün vefat ettiği, ölen sürücünün tam kusurlu olduğu, ancak trafik sigortacısının 3. kişilerin zararlarını teminat altına aldığı ve davacının da eşi konumunda olan ölenin desteğinden yoksun kaldığının açık olduğu gerekçesiyle, temin edilen bilirkişi raporu doğrultusunda poliçe limiti de gözönünde bulundurularak; ""1-Davanın ... yönünden açılmamış sayılmasına, 2-Davanın davalı ...Sigorta A.Ş. Yönünden kabulü ile 150.000,00 TL nin kaza tarihi olan 22/08/2009 tarihinden itibaren işleyecek yasal faiziyle birlikte davalıdan alınarak davacıya verilmesine,"" karar verilmiş, karar karşı davalı ... şirketi vekili tarafından süresi içinde istinaf yoluna başvrulmuştur. Davalı ... Sigorta A. Ş. vekilinin istinaf sebepleri; müteveffanın kazaya karışan aracın sürücüsü konumunda olduğundan 01/06/2015 tarihinde yürürlüğe giren ZMMS genel şartları ve KTK 92. maddesinde 26/04/2016 tarihinde yapılan değişiklik gereğince tazminat talebinin teminat kapsamı dışında olduğu, tazminat hesaplamasının genel şartlarda öngörülen şekilde yapılması gerektiği, kusur durumunun belirlenmesi gerektiği, kaza tarihinden itibaren temerrüt faizine hükmedilmesinin hatalı olduğu, ıslah ile artırılan tazminat miktarı için ıslah tarihinden itibaren faize hükmedilmesi gerektiği hususlarına ilişkindir. Dava, trafik kazası nedeniyle destekten yoksun kalma tazminatı talebine ilişkin bulunmaktadır. 1)İstinaf talebinde bulunan tarafın sıfatına, istinafın kapsam ve nedenine; dosya içindeki bilgi ve belgelere, Mahkeme kararının gerekçesinde dayanılan delillerin tartışılıp değerlendirilmesinde; hükme esas alınan uzman bilirkişi raporundaki belirlemelerin ve hesap yönteminin oluşa, yerleşmiş uygulamalara uygun denetime elverir gerekçeler içermesine; 22/08/2009 olan kaza tarihi itibariyle uygulanması gereken yasal mevzuat ve Yargıtay'ın yerleşmiş uygulamaları dikkate alındığında; sürücü- işleten destek ister kendi kusuru, ister bir başkasının kusuru ile ölmüş olsun, ölüm destekten yoksun kalanlar üzerinde doğrudan zarar doğuran bir sonuç olduğundan; desteğin kusurunun destekten yoksun kalanlara yansıtılamayacağı; araç sürücüsünün veya işleteninin tam kusurlu olması halinde dahi 3.kişi konumunda olan destekten yoksun kalan kişinin sigorta şirketinden tazminat isteme hakkına sahip olduğu konusunda duraksama bulunmadığına; bu durumda 3.kişi sıfatıyla dava açan destekten yoksun kalan kişi bakımından TBK'nun 135. maddesinde düzenlenen alacaklı-borçlu sıfatlarının birleşmesi durumunun da gerçekleşmemiş olmasına; kaza tarihinden çok sonra 01/06/2015 tarihinde yürürlüğe giren ZMMS genel şartlarının somut olayda uygulanma yerinin bulunmamasına, ıslah ile artırılan tazminat miktarı yönünden de temerrüt tarihinden itibaren faize hükmedilmesinde usul ve yasaya aykırılık bulunmamasına göre davalı ... şirketi vekilinin bu hususlardaki istinaf taleplerinin reddine karar verilmesi gerekmektedir. 2) 2918 sayılı KTK.’nun 99/1. ve kaza tarihi itibariyle yürülükte bulunan 15/08/2003 tarihli ZMSS Genel Şartları’nın B.2.b. maddesi uyarınca, sigorta şirketinin tazminatı ödeme yükümlülüğü kendisine riziko ihbarı yapıldıktan itibaren 8 işgünü sonunda başlar. Somut olayda, dosya kapsamından davalı ... şirketine bu yönde bir müracaat yapılmadığı anlaşılmaktadır. Kaza sonrasında sigorta şirketine başvuru yapılmadığı durumlarda sigorta şirketinin en erken dava tarihinde temerrüde düşürüldüğünün kabulü ile, dava tarihinden itibaren faizden sorumluluğuna hükmedilmesi gerekirken kaza tarihinden itibaren faize hükmedilmesi hatalı olmuştur. Ancak bu husus yeniden yargılamayı gerektirmediğinden Mahkemece verilen kararın kaldırılarak yeniden hüküm kurulması gerekmiştir.(HMK 353/1-b/2). HÜKÜM: Gerekçe uyarınca; 1- İstanbul 10. Asliye Ticaret Mahkemesi'nin 29/11/2016 tarih ve 2015/586 E.-2016/564 K. sayılı kararına karşı davalı ... Sigorta A. Ş. vekili tarafından yapılan istinaf talebinin yukarıda (1) nolu bentlerde açıklanan nedenlerle REDDİNE, (2) nolu bentte açıklanan nedenlerle KABULÜNE, 1/1- İstinaf yasa yoluna başvuran davalı ... Sigorta A. Ş. tarafından yatırılan 2.561,63-TL nispi istinaf karar ve ilam harcı ile 85,70-TL istinaf yoluna başvurma harcının talep halinde davalı tarafa İADESİNE, 1/2- İncelemenin duruşmasız olarak yapılması nedeniyle avukatlık ücreti takdirine yer olmadığına, 2- İstanbul 10. Asliye Ticaret Mahkemesi'nin 29/11/2016 tarih ve 2015/586 E.-2016/564 K. sayılı kararının KALDIRILMASINA, 2/1- Davanın ... yönünden açılmamış sayılmasına, 2/2- Davanın davalı ... A.Ş. yönünden kabulü ile 150.000,00-TL destekten yoksun kalma tazminatının dava tarihi olan 21/05/2015 tarihinden itibaren işleyecek yasal faiziyle birlikte davalı ... Sigorta A. Ş.'den alınarak davacıya verilmesine, 2/3- Harçlar tarifesine göre alınması gereken 10.246,50-TL karar ve ilam harcından peşin harç 27,70-TL ile ıslah harcı 505,16-TL olmak üzere toplam 532,86-TL harcın mahsubu ile bakiye 9.713,64-TL harcın davalı ... Sigorta A.Ş.'den tahsili ile Hazineye gelir kaydına, 2/4- Davacı taraf duruşmalarda vekil ile temsil edildiğinden ve kabul edilen dava değeri üzerinden hesap olunan 14.750,00-TL vekalet ücretinin davalı ... Sigorta A.Ş. den alınarak davacı tarafa verilmesine, 2/5- Davalı ... vekili duruşmalarda vekil ile temsil edildiğinden ve davanın bu davalı yönünden açılmamış sayılmasına karar verilmiş olmakla maktu 1.800,00-TL vekalet ücretinin davacıdan alınarak davalı ... Hesabına verilmesine, 2/6- Davalı ... tarafından yapıan 50,00-TL yargılama masrafının davacıdan tahsil edilerek davalı ... Hesabına ödenmesine, 2/7- Davacı tarafından yapılan peşin harç, vekalet harcı, başvuru harcı, ıslah harcı, bilirkişi ücretleri, posta, tebligat ve müzekkere masraflarından oluşan toplam 2.100,66-TL yargılama masrafının davalı ... Sigorta A.Ş.'den tahsil edilerek davacıya ödenmesine, 2/8- HMK 333. md. uyarınca davacı ve davalı tarafından yatırılan ve bakiye kalan gider avansının kararın kesinleşmesi sonrası talep halinde yatıran tarafa iadesine, Dosya üzerinde yapılan inceleme sonucunda, 20/07/2017 tarih ve 7035 sayılı Kanunun 31 inci maddesiyle değişik HMK. m. 361/1. hükmü gereğince, kararın tebliğinden itibaren 2 hafta içerisinde Yargıtay'a temyiz başvurusunda bulunma yolu açık olmak üzere, oy birliğiyle karar verildi.01/10/2018."
