"filename","mahkeme","dosya_no","karar_no","tarih","dava_konusu","icerik"
"2017_1040_2018_1370_444062900.html","15.HUKUK DAİRESİ","2017/1040","2018/1370","07/07/2017","Alacak","GEREĞİ GÖRÜŞÜLÜP DÜŞÜNÜLDÜ : Davacı vekili, taraflar arasında düzenlenen 10/07/2015 tarihli sözleşme ile davalıya ait ... İstanbul Projesi kapsamında temel çıkış rampası hafriyat işlerinin müvekkili tarafından yapılmasının kararlaştırıldığını, müvekkilinin edimlerini tamamladığını, ancak davalının 30/11/2015 tarihli 178574 seri nolu fatura ile 30.000,00 TL bedelli İş Güvenliği kesintisi yaptığını, müvekkilinin ayrıca 4.500,00 TL cari hesap bakiyesi olmak üzere davalıdan toplam 34.500,00 TL alacağı bulunduğunu, yapılan kesintinin sözleşmeye aykırı olduğunu, sözleşme gereği müvekkilinin dava dışı ... Birimi ve Eğitim Danışmanlık Mühendislik Hizmetleri Limited Şirketinden İş Güvenliği Hizmeti aldığını ve davalının işinde bu hizmetten yararlandığını, müvekkilinin 30/12/2015 tarihli ihtarname ile 34.500,00 TL'nin ödenmesinin istendiğini ve iade faturası düzenlenerek gönderildiğini, müvekkilinin iş sağlığı güvenliği kesintisini gerektirecek bir eyleminin olmadığını ileri sürerek, 34,500,00 TL'nin ihtarnamenin davalıya tebliğ tarihinden işleyecek en yüksek banka mevduat faizi ile davalıdan tahsiline karar verilmesini talep ve dava etmiştir. Davalı vekili, söz konusu cezanın İş Güvenliği Kesintisi olmayıp, gecikme cezası olduğunu, davacının işi 10/08/2015 tarihinde bitirilmesi gerekirken 06/11/2015 tarihinde bitirdiğini, sözleşmenin 11 Maddesi uyarınca 6 Günlük Gecikme Cezası karşılığı 30.000,00 TL gecikme cezası kesildiğini, davacı tarafından kesilen faturanın iade faturasıyla iade edildiğini, taraflarca imzalanan hakediş kapak formunda İş Güvenliği Kesintisi ve Gecikme Cezasının aynı kalemde yer aldığı için davacı tarafa müvekkili şirket tarafından gönderilen fatura üzerine sehven ""Hakediş İş Güvenliği Kesintisi"" yazıldığını, davacı tarafın söz konusu kesintinin gecikme cezası olduğunu bilerek kötü niyetli davranarak ve müvekkil şirkete iade faturası kestiğini belirterek, davanın reddine karar verilmesini istemiştir. Mahkemece, taraflar arasında kararlaştırılan cezai şartın ifaya ekli cezai şart olduğu, sözleşme gereğince işin 10/08/2015 tarihinde bitmesi kararlaştırılmasına rağmen, 82 günlük bir gecikme yaşandığı, sözleşmenin 11.maddesi gereğince davalının ''Hakediş İş Güvenliği Kesintisi'' adı altında 30/11/2015 tarihli 178574 nolu 30.000,00 TL fatura düzenlediği, faturanın davacı defterlerinde kayıtlı olmadığı, davacı defterlerine göre dava tarihi itibariyle davacının 34.500,00 TL alacaklı olduğunun anlaşıldığı, kesin hakediş kapağının taraflarca imzalandığından ifaya eklenen cezai şart niteliğindeki 30/11/2015 tarihli 178574 nolu 30.000,00 TL fatura bedelinin mahsubunun gerektiği, bu durumda davacının 4.500,00 TL bakiye cari hesap alacağının kaldığı gerekçeleriyle davanın kısmen kabulü ile, 4.500,00 TL'nin 08/01/2016 tarihinden itibaren işleyecek en yüksek avans faizini geçmemek üzere en yüksek banka mevduat faizi ile davalıdan alınarak davacıya verilmesine, davacının fazlaya ilişkin taleplerinin reddine karar verilmiştir. Davacı vekili istinaf dilekçesinde, müvekkilinin edimlerini yerine getirmiş olması nedeniyle davalının 30/11/2015 tarihli faturayla yaptığı kesintinin sözleşmeye aykırı olduğunu, oysa müvekkilinin dava dışı ... isimli firmadan iş güvenliği hizmeti aldığını ve davacı için yaptığı işte bu hizmetten faydalandığını, düzenlenen hakediş kapağında 30.000,00 TL'nin İSG ceza kesintisi olarak belirtildiğini, ancak müvekkilinin iş sağlığı güvenliğini tam sağladığından ceza kesintisi yapılmasını gerektirir bir husus bulunmadığını, davalının ceza kesintisi yapılmasını gerektirir bir sebep de bildirmediğini, buna rağmen mahkemece kesintinin gecikme cezası olduğu kabulü ile davanın kısmen kabulüne karar vermesinin hatalı olduğunu, bilirkişi raporunda kesintinin 6 günlük gecikme cezası olarak yapıldığı belirtilmesine rağmen davacının bu hususu ispat edemediğini, işin gecikmesinin müvekkilinden kaynaklanmayıp, müvekkilinin yaptığı hafriyat işinin iksa ve kazı işlerine bağlı olduğundan davalının kazı ve iksa işini geciktirmesi nedeniyle müvekkilinin de hafriyat atığını almasının geciktiğini, bu durumun davalının bilgisi dahilinde olduğundan müvekkilinden talepte bulunmadığını ve gecikme cezası istemediğini, davalının kendi kusurlu davranışı ile ifanın geciktiğinin farkında olduğunu, mahkemenin davalının usulsüz işlemini onaylar nitelikte karar verdiğini, faturanın konusunun gecikme cezası olduğu kabul edilseydi davalının iade faturasından sonra yeni fatura kesmesi gerektiğini, davalının iş güvenliği kesintisi yaptığını, fakat bunu yapmak için bir nedeni de bulunmadığını, bu nedenlerle, mahkemenin davalıdan 34.500,00 TL'nin tahsiline karar verilmesi gerekirken kısmen kabul kararı vermesinin hatalı olduğunu belirterek, yerel mahkeme kararının kaldırılarak, davanın tümden kabulüne karar verilmesini istemiştir. Dava, eser sözleşmesinden kaynaklanan iş bedeli alacağının tahsili istemine ilişkindir. Davacı yüklenici 34.500,00 TL iş bedeli alacağı bulunduğunu, bunun 30.000,00 TL'sinin iş sahibi tarafından iş sağlığı ve güvenliği kesintisi adıyla haksız olarak kesildiğini belirterek, tahsilini istemiş, davalı ise söz konusu kesintinin iş sağlığı güvenliği kesintisi olarak bildirilmesinin hataya dayandığını, aslında gecikme cezası niteliğinde olduğunu savunmuştur. Bilirkişilerce yapılan inceleme ve hesaplamalar sonucu düzenlenen 31/08/2016 tarihli bilirkişi kurulu raorunda, söz konusu kesintinin sözleşmenin 11. Maddesi gereğince ifaya ekli cezai şart niteliğindeki 6 günlük gecikme cezasından kaynaklandığı, kesin hakediş kapağının da taraflarca imzalandığı, faturanın kabulü halinde 34.500,00 TL fatura bedelinden 30.000,00 TL'nin mahsubu halinde davacının 4.500,00 TL bakiye cari hesap alacağı bulunduğu belirtilmiştir. 19/01/2017 tarihli raporda ise, dava konusu faturanın her iki taraf defterlerinde kayıtlı olduğu, davalının 30.000,00 TL iade faturası düzenlediği, faturanın gecikme cezasına ilişkin olduğunun kabulü halinde davacının 4.500,00 TL alacaklı olacağı, faturanın geçerli olmadığının kabulü halinde ise davacının 34.500,00 TL alacaklı olacağı belirtilmiştir. Somut olayda tüm dosya kapsamına göre, davacının işi süresinde bitirmediği, gecikmenin davacı tarafın yapması gereken işlerin gecikmesinden kaynaklandığını belirtmesine rağmen, bu hususu ispatlayacak nitelikte yasal delil sunulmadığı, bilirkişilerce de sözleşmenin 11. Maddesi hükmünün ifaya ekli ceza niteliğinde olduğu, günlük en az 5.000,00 TL'den 6 günlük gecikmenin 30.000,00 TL gecikme cezası gerektirdiğinden davalı tarafça yapılan kesintinin yerinde olduğu, bu durumda davacının 4.500,00 TL cari hesap alacağı bulunduğu anlaşılmakla, yerel mahkemece verilen karar doğru olmuştur. Açıklanan nedenlerle, yerel mahkeme kararı usul ve yasaya uygun bulunduğundan, davacı vekilinin istinaf talebinin esastan reddine karar verilmesi gerekmiştir. HÜKÜM: Gerekçesi açıklandığı üzere; 1-Bakırköy 1. Asliye Ticaret Mahkemesinin 07/07/2017 tarih ve 2016/94 Esas, 2017/501 Karar sayılı kararında usul ve esas yönünden yasaya aykırı bir durum bulunmamasına göre, davacı vekilinin istinaf başvurusunun HMK'nın 353/1-b-1 maddesi gereğince esastan REDDİNE, 2-Alınması gereken 35,90-TL istinaf karar harcından peşin alınan 31,40-TL'nin mahsubu ile bakiye 4,50-TL istinaf karar harcının davacıdan alınarak hazineye gelir kaydına, 3-Davacı tarafça yapılan istinaf yargılama giderlerinin üzerinde bırakılmasına, 4-İstinaf incelemesi sırasında duruşma açılmadığından davalı yararına vekâlet ücreti takdirine yer olmadığına, Dosya üzerinden yapılan inceleme sonucunda, HMK'nın 362/1-a bendi gereğince miktar itibariyle KESİN olmak üzere 24/10/2018 tarihinde oybirliği ile karar verildi."
"2017_1041_2018_990_435186800.html","8. HUKUK DAİRESİ","2017/1041","2018/990","11/05/2017","Hakem Kararının Tebliğe Çıkarılması / Saklanması","GEREĞİ DÜŞÜNÜLDÜ:Başvuranlar vekili Sigorta Tahkime Komisyonuna verdiği dilekçede özetle; davalı ... şirketi nezdinde trafik sigortalı olan ... plaka sayılı aracın sürücüsü ve vekil edenlerinin oğlu bulunan destek ...r'in 30/07/2011 tarihinde kusuru neticesinde yaptığı tek taraflı trafik kazasında hayatını kaybettiğini, davalı ... şirketine yapılan başvurulardan da sonuç alınamadığını belirterek fazlaya ilişen haklar saklı kalmak kaydıyla, (belirsiz alacak) davacı baba ... için 10.000,00-TL davacı anne ... için de 13.000,00-TL olmak üzere toplam 23.000,00-TL destekten yoksun kalma tazminatını kaza tarihinden işletilecek avans faizi ile birlikte davalıdan tahsiline karar verilmesini istemiş, 11/01/2017 günlü dilekçe ile de, davacı ... için olan istek miktarını 85.399,24-TL'ye, davacı ... için olan istek miktarını da 54.686,86-TL'ye çıkarttıklarını açıklamıştır. Davalı ... şirketi vekili cevabında özetle; zamanaşımı definde bulunarak davacıların taleblerinin dava konusu kazanın sürücü desteğin tam kusuru neticesinde meydana gelmesi nedeniyle teminat dışı olduğunu ve olay tarihinden itibaren faiz istenemeyeceğini belirterek davanın reddine karar verilmesini istemiştir. Sigorta Tahkim Komisyonu Uyuşmazlık Hakem Heyetince; 30/07/2011 tarihinde meydana gelen trafik kazasında ... plaka sayılı araç sürücüsü ...'in hayatını kaybettiği, aracın davalı ... şirketi nezdinde trafik sigortalı bulunduğu ve limitin 200.000,00-TL ile sınırlı olduğu, davacıların ölenin anne ve babası olması nedeniyle destekten yoksun kalma tazminatı talep etme haklarının bulunduğu, ölenin gelirinin asgari ücret üzerinde olduğunun, aynı kaza nedeniyle desteğin eş ve çocukları tarafından Ankara 3.Asliye Ticaret Mahkemesinde açılan 2013/17 esas 2014/229 Karar sayılı ilamla belirlendiği görüşünden hareketle, hükme esas alınan 05/01/2017 günlü ek hesap bilirkişi raporundaki belirlemeler ile talep arttırım dilekçesindeki açıklamalar dikkate alınarak, başvuranların talebinin kabulü ile ... için 85.399,24-TL, ... için de 54.686,86-TL olmak üzere toplam 140.086,10-TL destekten yoksun kalma tazminatının 01/11/2016 tarihinden işletilecek yasal faizi ile birlikte davalı ... şirketinden tahsiline karar verilmiş, davalı ... şirketi vekilinin Sigorta Tahkim Komisyonu İtiraz Hakem Heyetine itirazı üzerine, itiraz hakem heyetince başvuranların destek tazminatı taleplerinin hesaplamasında esas alınacak aylık gelir durumunun ve diğer hususların belirlendiği, Ankara 3.Asliye Ticaret Mahkemesinin 2013/17 esas ve 2014/229 Karar sayılı dosyasının temyiz incelemesi için yargıtaya gittiği, o dosyanın sonucunun görülmekte olan davayı etkileyeceği, dolayısıyla ticaret mahkemesi dosyasının bekletici mesele yapılması gerektiği, itiraz konusu uyuşmazlık hakem heyeti kararının eksik inceleme ile verildiği, ancak dosyadaki mevcut eksikliklerin giderilmesi ve yargıtayda bulunan dava dosyasının sonuçlanmasının 5684 sayılı Sigortacılık Kanununun 30.madde kapsamında iki aylık itiraz süresi içerisinde sonuçlandırılmasının mümkün olmadığı, uyuşmazlığın yetkili ve görevli mahkemede görülmesi gerektiği görüşünden hareketle, davalı ...Ş.vekilinin esas yönünden incelenmesi mümkün olmayan itirazının usul yönünden kabulü ile Sigorta Tahkim Komisyonu Uyuşmazlık Hakem Heyetinin 24/01/2017 tarih 2017/2923 sayılı kararının kaldırılmasına, uyuşmazlığın yetkili ve görevli mahkemede görülmesi gerektiğinden 08/11/2016 tarih 2016.E.34833 sayılı başvuru talebinin görev yönünden reddine karar verilmiştir. İtiraz hakem heyeti kararına karşı davacılar vekili tarafından istinaf yasa yoluna başvurulmuştur. İstinaf nedenleri; müteveffanın eş ve çocukları tarafından açılan ve Ankara 3.Asliye Ticaret Mahkemesinde görülen 2013/17 esas sayılı dava dosyasının sonucunun, görülmekte olan davayı etkilemeyeceği, zira destekten yoksun kalanların tazminat haklarının birbirine bağlı olmadığı, yargılamanın tahkim yargılaması olduğu, mevcut duruma göre bir karar verilmesine engel bir husus bulunmadığı halde, yazılı biçim ve gerekçeyle Sigorta Tahkim Komisyonu İtiraz Hakem Heyetince verilen kararın usulsüz olduğu hususlarına yöneliktir. Dava, trafik kazası sonucunda meydana gelen ölüm olayına bağlı olarak açılmış destekten yoksun kalma tazminatı isteğine ilişkindir. Dosya içerisindeki bilgi ve belgelere, itiraz hakem heyeti kararının gerekçesinde dayanılan delillerin tartışılıp değerlendirilmesinde bir isabetsizlik bulunmadığına; destek İzzet Kaplaner'in eş ve çocukları tarafından açılan, aynı olaya ilişkin bulunan ve davalı ... şirketinin de davalı olarak taraf sıfatını aldığı destek zararının giderilmesi isteğini içeren Ankara 3.Asliye Ticaret Mahkemesinde görülen davanın sonucunun görülmekte olan davayı etkileyeceğinin belirgin olmasına ve bu durumda görülmekte olan tahkim yargılamasının yasal süre içerisinde sonuçlandırılabilmesinin olanaklı bulunmamasına göre; davacılar vekilinin istinaf itirazlarının HMK.m.353/1-b/1 hükmü uyarınca esastan reddi gerektiği sonucuna varılarak aşağıdaki biçimde hüküm tesis edilmiştir. HÜKÜM: Gerekçe uyarınca; 1-Usul ve esas yönünden hukuka uygun olan 17/04/2017 gün ve2017/İ.652-2017/İHK.1272 sayılı Sigorta Tahkim Komisyonu İtiraz Hakem Heyeti kararına yönelik olarak davacılar vekili tarafından yapılan istinaf başvurusunun HMK.m.353/1-b/1 hükmü uyarınca ESASTAN REDDİNE, 2-İstinaf yasa yoluna başvuran davacılardan alınması gereken başvurma harcının peşin olarak yatırıldığı anlaşıldığından bu konuda karar verilmesine YER OLMADIĞINA, fazladan alınan 31,40-TL maktu karar ve ilam harcının ise, talep halinde davacılara İADESİNE, 3-İncelemenin duruşmasız olarak yapılması nedeniyle avukatlık ücreti takdirine yer olmadığına, 4-İstinaf yasa yoluna başvuran davacılar tarafından istinaf aşamasında yapılan giderlerin üzerlerinde bırakılmasına, HMK. m. 353/1-b/1 hükmü uyarınca, dosya üzerinde yapılan inceleme sonucunda ve 7035 sayılı Kanunun 31 maddesi ile değişik HMK. m. 361/1 maddesi gereğince, kararın tebliğinden itibaren 2 hafta içinde Yargıtay nezdinde temyiz yasa yolu açık olmak üzere, oy birliğiyle karar verildi.04/10/2018."
"2017_1042_2018_1025_441907000.html","8. HUKUK DAİRESİ","2017/1042","2018/1025","15/05/2017","Hakem Kararının Tebliğe Çıkarılması / Saklanması","GEREĞİ DÜŞÜNÜLDÜ: Davacılar vekili dava dilekçesi ile 05/01/2016 tarihinde davacıların murisi ...'in sevk ve idaresindeki ... plâkalı aracı ile park halinde bulunan ... plâkalı çekici arkasında takılı olan ... plâkalı römorka çarpması şeklinde meydana gelen trafik kazasında vefat ettiğini, muris ...'in kullandığı ... plâkalı aracın kaza tarihi itibarıyla davalı ... şirketince ZMSS poliçesi ile sigortalı olduğunu, davacıların murislerinin ölümü nedeniyle onun desteğinden yoksun kaldıklarını belirterek fazlaya ilişkin hakları saklı kalmak kaydıyla şimdilik davacı ... için 20.000,00-TL, davacı ... için 3.000,00-TL olmak üzere toplam 23.000,00-TL destekten yoksun kalma tazminatının davalı ... şirketinden tahsiline karar verilmesini talep etmiş, 06/12/2016 tarihli talep artırım dilekçesi ile talebini ... için 180.748,54-TL'ye .... için 60.645,16-TL'ye yükseltmiştir. Davalı ... vekili cevap dilekçesi ile; davacının tazminat talebinin sigorta teminatı kapsamında bulunmadığını belirterek talebin reddine karar verilmesini istemiştir. Sigorta Tahkim Komisyonu Uyuşmazlık Hakem Heyetince; davacıların üçüncü kişi sıfatıyla destekten yoksun kalma tazminatı talep etme haklarının bulunduğu gerekçesiyle talebin kabûlü ile davacı ... için belirlenen 180.749,54-TL, davacı ... için belirlenen 60.645,16-TL destekten yoksun kalma tazminatının davalı ... şirketinden tahsiline karar verilmiş, karara karşı davalı ... vekilince yapılan itiraz üzerine İtiraz Hakem Heyetince itirazın reddine karar verilmiş ve karara karşı davalı ... vekilince istinaf yoluna başvurulmuştur. Davalı ... vekilinin istinaf sebepleri; meydana gelen kazada davacılar murisinin asli kusurlu olduğu, davacıların üçüncü kişi konumunda olmadıkları, talebin sigorta teminatı kapsamı dışında olduğu hususlarına ilişkindir. Dava, trafik kazası nedeniyle destekten yoksun kalma tazminatı talebine ilişkin bulunmaktadır. Dosya kapsamında bulunan 05/01/2016 tarihli trafik kazası tespit tutanağına göre, kazanın oluşumunda ... plakalı motosiklet sürücüsü ...'in kusurlu olduğu tespit edilmiştir. Yine Bodrum Cumhuriyet Başsavcılığı'nın 2016/90 soruşturma sayılı dosyası kapsamında temin edilen 02/05/2016 ve 02/03/2016 tarihli bilirkişi raporlarında da kazanın meydana gelmesinde ... plakalı motosiklet sürücüsü ...'in 1. derecede asli kusurlu olduğu, ... plakalı çekici ve ... plakalı yarı römorku park eden sürücü ...'in 2. derecede tali kusurlu olduğu tespit edilmiştir. Dosya arasında bulunan kayıt ve belgeler, tarafların iddia ve savunmaları, itirazları, itirazların kapsamı değerlendirildiğinde; taraflar arasında davalı ... nezdinde başlangıç tarihi 10/09/2015, bitiş tarihi ise; 10/09/2016 olan ZMM sigorta poliçesi ile sigortalı olan ... plaka sayılı motosikletin sürücüsü bulunan ....'in asli kusuru neticesinde 05/01/2016 tarihinde meydana gelen trafik kazasında hayatını kaybettiği konusunda bir uyuşmazlık bulunmamaktadır. Uyuşmazlık bu durumda destekten yoksun kalan davacı eş ve çocuğun; üçüncü kişi konumunda olup olmadığı ve desteğin kusurunun kendilerine yansıtılıp yansıtılamayacağı, sonucu itibariyle de davacıların destekten yoksun kalma tazminatı talep etme hakkı bulunup bulunmadığına ilişkindir. 01/06/2015 tarihinde yürürlüğe giren Karayolları Motorlu Araçlar Zorunlu Mali Sorumluluk Sigortası Genel Şartları; yürürlüğe girmesinden sonra düzenlenen poliçelerde geçerli olacağından, poliçenin düzenlendiği tarih itibariyle Karayolları Motorlu Araçlar Zorunlu Mali Sorumluluk Sigortasının kapsamı tüm taraflarca bilinmektedir. Genel şartlarda içeriği belirlenmiş tazminatlara ilişkin talepler bakımından sigortacının sorumluluğu, kaza tarihinde geçerli olan poliçe kapsamında ve sigorta limitleri dahilinde üçüncü kişilerin uğradıkları zararları tazmin etmekte sınırlıdır. 2918 sayılı Karayolları Trafik Kanununun 92. maddesinin (a) ve (c) bentleri, Trafik Sigortası Genel Şartları A.1 ve A.3 maddesi, A.5 maddesinin (ç) bendi ve yine A.6 maddesinin (c) ve (d) bentleri birlikte değerlendirildiğinde; bir motorlu aracın işletilmesi sırasında meydana gelen ölüm olayına bağlı olarak destekten yoksun kalma halinde, destekten yoksun kalınan zararın ZMM sorumluluk kapsamında olması için ölenin üçüncü kişi olması ve desteğin kusursuz bulunması gerekmektedir. Somut olayda; davacıların desteği sürücü ...'in sevk ve idaresindeki ... plaka sayılı motosiklet ile 05/01/2016 tarihinde yapmış olduğu trafik kazasında öldüğü, trafik kazası tespit tutanağı ve bilirkişi raporları ile kazanın meydana gelmesinde asli kusurlu olduğu anlaşılmaktadır. Bu durumda davalı ... şirketinin sorumluluğu 01/06/2015 tarihinde yürürlüğe giren Karayolları Motorlu Araçlar Zorunlu Mali Sorumluluk Sigortası Genel Şartlarına göre düzenlenen ve başlangıç tarihi 10/09/2015 olan poliçe şartlarına göre belirlenecektir. Karayolları Motorlu Araçlar Zorunlu Mali Sorumluluk Sigortası Genel Şartları A.3 Karayolları Motorlu Araçlar Zorunlu Mali Sorumluluk Sigortası Genel Şartları A.3 maddesine ve A.5 maddesinin (ç) bendine göre; ancak üçüncü kişinin ölümü dolayısıyla meydana gelen destek zararları, destekten yoksun kalma teminatı kapsamındadır. Sigortacının destek zararlarından sorumlu olması için motorlu aracın işletilmesi sırasında, mutlaka ölen kişinin üçüncü kişi olması gerekir. Bundan ayrı yine genel şartların A.6 maddesi (d) bendinde; destekten yoksun kalan hak sahibinin sigortalının sorumluluk riski kapsamında olmakla beraber destek şahsın kusuruna denk gelen destek tazminatı talepleri, teminat dışı tutulduğundan; asli kusuru ile kendi ölümüne neden olan sürücü ...'in kusuruna isabet eden destek tazminatı sigorta teminatı kapsamında değildir. Kaza tarihinde yürürlükte bulunan Karayolları Trafik Kanununda da sigortalının sorumluluk riski kapsamında olmayan destek tazminatı talepleri ile destekten yoksun kalan hak sahibinin, sigortalının sorumluluk riski kapsamında olmakla beraber destek şahsın kusuruna denk gelen destek tazminatı taleplerinin sigorta teminatı kapsamında olduğuna ilişkin bir düzenleme olmadığı ve kapsama giren teminat türleri arasında sayılmadığına göre; davacının kendi sigortasından destek tazminatı talep etme hakları olmadığından (Yargıtay 17.hukuk Dairesi'nin 29/05/2017 tarih ve 2016/14573-2017/6035 sayılı kararı, Yargıtay 17. Hukuk Dairesi'nin 08/05/2018 tarih ve 2017/4323-2018/4743 sayılı kararı), yine kazaya neden olduğu kabul edilen park halindeki ... plakalı çekici ve ... plakalı yarı römorkun sigortacısına karşı da açılan bir dava bulunmamasına, davacı tarafın müteselsil sorumluluk esasları doğrultusunda dava açmamış olmasına göre; davacının başvurusunun reddine karar verilmesi gerekirken, kabulüne karar verilmesi doğru görülmemiştir. Ancak bu yanılgının giderilmesi yeniden yargılama yapılmasını gerektirmediğinden; İtiraz Hakem Heyetince verilen kararın kaldırılarak, davacıların destekten yoksun kalma tazminatı talebinin reddine karar verilmesi gerekmiştir.(HMK.m.353/1-b/2). HÜKÜM: Gerekçe uyarınca; 1- Davalı ... A. Ş. vekilince, Sigorta Tahkim Komisyonu İtiraz Hakem Heyetinin 22/04/2017 tarih ve 2017/İ.554-2017/İHK-1113 sayılı kararına karşı yapılan istinaf talebinin yukarıda gösterilen nedenlerle KABULÜNE, 1/1- İstinaf yasa yoluna başvuran davalı tarafından peşin olarak yatırılan 4.125,00-TL nispi istinaf karar ve ilam harcı ile 85,70-TL istinaf yoluna başvurma harcının talebi halinde davalıya İADESİNE, 1/2- İncelemenin duruşmasız olarak yapılması nedeniyle avukatlık ücreti takdirine yer olmadığına, 2/- Sigorta Tahkim Komisyonu İtiraz Hakem Heyetinin 22/04/2017 tarih ve 2017/İ.554-2017/İHK-1113 sayılı kararının KALDIRILMASINA, 2/1- Davacılar tarafından destekten yoksun kalma tazminatı talebiyle açılan davanın REDDİNE, 2/2- Davalı ... A. Ş., davacılar tarafından açılan davada kendini vekille temsil ettirdiğinden 5684 Sayılı Kanunun 30/17 ve karar tarihinde yürürlükte bulunan AAÜT 17/2. maddesi gereğince belirlenen 4.086,71-TL vekâlet ücretinin davacılardan alınarak davalı ... A. Ş.'ye verilmesine, 2/3- Davacı tarafça Sigorta Tahkim Komisyonu nezdinde yapılan yargılama sırasında yapılan yargılama giderlerinin kendi üzerinde bırakılmasına, 2/4- Davalı ... A. Ş. Tarafından sigorta tahkim komisyonu nezdindeki yargılama sırasında yapılan 3.630,00-TL yargılama giderinin davacı taraftan alınarak davalı ... A. Ş.'ye verilmesine, Dosya üzerinde yapılan inceleme sonucunda, 20/7/2017 tarih ve 7035 sayılı Kanunun 31 inci maddesiyle değişik HMK. m. 361/1. hükmü gereğince, kararın tebliğinden itibaren 2 hafta içerisinde Yargıtay'a temyiz başvurusunda bulunma yolu açık olmak üzere, oy birliğiyle karar verildi.04/10/2018."
